Preferred term,Category,Source,Source2,Variants,Var source,Variants2,Definition,Definition source,Applicable profession,Related term,Relationship,Related term 2,Relationship2,Main category,Flag,Notes,LCSH Heading,LCSH link,OHP Core
16mm film,TP,PST,,16mm camera,,,16 mm film is a historically popular and economical gauge of film,,,,,,,,,,,,
35mm film,TP,PST,,,,,The standard photographic film format for analog SLR still cameras and motion picture cameras,,,,,,,,,,,,
8mm film,TP,PST,,,,,8 mm film is a motion picture film format in which the film strip is eight millimeters wide,,,,,,,,,,,,
Academy Award,AW,PST,,Oscar,,,Any of a series of awards of the Academy of Motion Picture Arts and Sciences in Hollywood given annually since 1928 for achievement in the movie industry in various categories,,,,,,,,,,,,
Activism,GT,PST,,,,,The policy or action of using vigorous campaigning to bring about political or social change,,,,,,,,,,,,
Adaptation,GT;PC,PST,,,,,"Film adaptation. A film adaptation is the transfer of a written work, in whole or in part, to a feature film",,,,,,,,,,,,
Addiction,GT,PST,,Addict,,,"The fact or condition of being addicted to a particular substance, thing, or activity",,,,,,,,,,,,
Afro-Colombian,GT,PST,,,,,Colombian citizens of African descent,,,,,,,,,,,,
Agent,PC,PST,,,,,A business representative (as of an athlete or entertainer) •,,,,,,,,,,,,
American film industry,GT,PST,,Hollywood Cinema,,American Commercial Cinema,American commercial cinema which has financially and stylistically dominated global markets from World War II to the present,,,,,,,,,,,,
American history,GT,PST,,,,,,,,,,,,,,,,,
Anthropology,GT,PST,,,,,"The study of human beings and their ancestors through time and space and in relation to physical character, environmental and social relations, and culture",,,,,,,,,,,,
Anti-semitism,GT,PST,,,,,Hostility to or prejudice against Jews.,,,,,,,,,,,,
Archaeology,GT,PST,,,,,"The scientific study of material remains (such as fossil relics, artifacts, and monuments) of past human life and activities",,,,,,,,,,,,
Archival material,TP,PST,,,,,,,,,,,,,,,,,
Argentina,GT,PST,,,,,,,,,,,,,,,,,
Ariel Award,AW,PST,,,,,"The Ariel is the Mexican Academy of Film Award. It has been awarded annually since 1947. The award recognizes excellence in motion picture making, such as acting, directing and screenwriting in Mexican cinema. It is considered the most prestigious award in the Mexican movie industry. In cinema, it is considered Mexico's equivalent to the Academy Awards (""Oscars"") of the United States",,,,,,,,,,,,
Art film,GF,PST,,,,,A motion picture produced as an artistic or experimental venture,,,,,,,,,,,,
Assistant,SP,PST,,,,,A person who helps in particular work.,,,,,,,,,,,,
Audience,GT,PST,,,,,"The assembled spectators or listeners at a public event, such as a play, movie, concert, or meeting.",,,,,,,,,,,,
Autobiography,GT,PST,,,,,The biography of a person narrated by himself or herself,,,,,,,,,,,,
Auto-da-fe,ET,PST,,,,,the burning of a heretic by the Spanish Inquisition,,,,,,,,,,,,
Automatic writing,GT,PST,,,,,"writing said to be produced by a spiritual, occult, or subconscious agency rather than by the conscious intention of the writer.",,,,,,,,,,,,
Awards,AW,PST,,,,,a prize or other mark of recognition given in honor of an achievement.,,,,,,,,,,,,
Baroque art,ET,PST,,,,,"The Baroque is often thought of as a period of artistic style which used exaggerated motion and clear, easily interpreted detail to produce drama, tension, exuberance, and grandeur",,,,,,,,,,,,
Basque culture,GT,PST,,,,,"A member of a people living in the Basque Country of France and Spain. Culturally one of the most distinct groups in Europe, the Basques were largely independent until the 19th century",,,,,,,,,,,,
Bay of Pigs Invasion (1961),ET,PST,,,,,"An unsuccessful invasion of Cuba by Cuban exiles, supported by the U.S. government",,,,,,,,,,,,
Berlin International Film Festival,ET,PST,,,,,"Berlin International Film Festival, German Internationale Filmfestspiele Berlin, also called Berlinale, one of the world’s largest film festivals, held annually in Berlin in February.",,,,,,,,,,,,
Birthplace/Place of origin,GT,PST,,,,,"Usually answers to the question ""Where were you born and in what circumstances?""",,,,,,,,,,,,
Black and white film,TP,PST,,,,,,,,,,,,,,,,,
Black Panther Party,GT,PST,,,,,"An African American revolutionary party, founded in 1966 in Oakland, California by Huey Newton and Bobby Seale.",,,,,,,,,,,,
Blu-ray,TP,PST,,,,,"Is a digital optical disc data storage format. It was designed to supersede the DVD format, in that it is capable of storing hours of video in high-definition (720p and 1080p) and ultra high-definition resolution (2160p).",,,,,,,,,,,,
Boarding School,GT,PST,,,,,A school where students reside during the semester,,,,,,,,,,,,
Border,GT,PST,,,,,"Liminal space, both literal and figurative, that divides two cultures or territories",,,,,,,,,,,,
Bossa Nova music,GF,PST,,,,,"Bossa nova is a genre of Brazilian music, which developed and was popularized in the 1950s and 1960s and is today one of the best-known Brazilian music genres abroad. The phrase bossa nova means literally ""new trend"" . A lyrical fusion of samba and jazz, bossa nova acquired a large following in the 1960s, initially among young musicians and college students.",,,,,,,,,,,,
Brazil,GT,PST,,,,,,,,,,,,,,,,,
Brazilian Communist Party,GT,PST,,,,,"founded on March 25, 1922 in the city of Niterói, Rio de Janeiro",,,,,,,,,,,,
Camera,TP,PST,,,,,A device that consists of a lightproof chamber with an aperture fitted with a lens and a shutter through which the image of an object is projected onto a surface for recording (as on film) or for translation into electrical impulses (as for television broadcast,,,,,,,,,,,,
Camera dolly,TP,PST,,,,,A camera dolly is a wheeled cart or similar device used in filmmaking and television production to create smooth horizontal camera movements.,,,,,,,,,,,,
Cameraman,SP,PST,,,,,A person who operates a camera (as for motion pictures or television),,,,,,,,,,,,
Cannes Film Festival,ET,PST,,,,,"official name Festival de Cannes, film festival held annually in Cannes, France. First held in 1946 for the recognition of artistic achievement, the festival came to provide a rendezvous for those interested in the art and influence of the movies. Like other film festivals, it became an international marketplace where producers and distributors could exchange ideas, view films, and sign contracts",,,,,,,,,,,,
Carioca,GF,PST,,,,,A native of Rio de Janeiro.,,,,,,,,,,,,
Cartoon,GF,PST,,,,,"A motion picture that is made from a series of drawings, computer graphics, or photographs of inanimate objects (such as puppets) and that simulates movement by slight progressive changes in each frame",,,,,,,,,,,,
Casting,PC,PST,,,,,The assignment of parts and duties to actors or performers,,,,,,,,,,,,
Catholic,GT,PST,,,,,"Of, relating to, or forming the ancient undivided Christian church or a church claiming historical continuity from it",,,,,,,,,,,,
Catholic school,GT,PST,,,,,Parochial schools or education ministries of the Catholic Church.,,,,,,,,,,,,
Censorship,GT,PST,,,,,"The suppression or prohibition of any parts of books, films, news, etc. that are considered obscene, politically unacceptable, or a threat to security.",,,,,,,,,,,,
Chanchada comedy,GF,PST,,Low budget comedy,,,Popular dramas and burlesque musical comedies. Common in Brazil between the 1930s and 1960s.,,,,,,,,,,,,
Character,GT,PST,,Fictional character,,,"A character is a person or other being in a narrative work of art (such as a novel, play, television series, or film)",,,,,,,,,,,,
Chicago International Film Festival,ET,PST,,,,,"An annual film festival held every fall. Founded in 1964 by Michael Kutza, it is the longest-running competitive film festival in North America",,,,,,,,,,,,
Chicano identity,GT,PST,,,,,"American of Mexican descent, usually 1st, 2nd, 3rd generation
",,,,,,,,,,,,
Chicano Movement,GT,PST,,,,,"1960s farmworker strike in CA, TX. Cesar Chavez, Dolores Huerta
Chicano, feminine form Chicana, identifier for people of Mexican descent born in the United States. The term came into popular use by Mexican Americans as a symbol of pride during the Chicano Movement of the 1960s.",,,,,,,,,,,,
"Chihuahua, Mexico",GT,PST,,,,,Chihuahua officially the Free and Sovereign State of Chihuahua is one of the 32 states of Mexico. Its capital city is Chihuahua City,,,,,,,,,,,,
Childhood,GT,PST,,,,,"period of the human lifespan between infancy and adolescence, extending from ages 1–2 to 12–13. See child development.",,,,,,,,,,,,
Choreography,GT,PST,,,,,"Is the art or practice of designing sequences of movements of physical bodies (or their depictions) in which motion, form, or both are specified",,,,,,,,,,,,
"Cienfuegos, Cuba",GT,PST,,,,,"is a city on the southern coast of Cuba. It is located about 250 km (160 mi) from Havana and has a population of 150,000. The city is dubbed La Perla del Sur (Pearl of the South). Cienfuegos literally translates to ""one hundred fires""—cien meaning ""one hundred"", fuegos meaning ""fires"".",,,,,,,,,,,,
CinéChèque Nationale,GT,PST,,,,,?? Follow up -,,,,,,,,,,,,
Cinema Novo,GF,PST,,Brazilian New Wave Cinema,,,"Part of the New Latin American Cinema movement of the 1960s. Brazillian film movement characterized by neorealist style, use of non-actors, and explicitly political message.",,,,,,,,,,,,
Cinematographer,PC,PST,,,,,Person responsible for making artistic and technical decisions related to the image,,,,,,,,,,,,
Cinematography,TP,PST,,,,,"the planning and control of lighting and camera during film production. The person responsible for a film's cinematography is known as the cinematographer or director of photography, sometimes abbreviated to DoP",,,,,,,,,,,,
Cinephilia,GT,PST,,,,,"Cinephilia is the term used to refer to a passionate interest in cinema, film theory and film criticism. The term is a portmanteau of the words cinema and philia, one of the four ancient Greek words for love.[1] A person with a passionate interest in cinema is called a cinephile, cinemaphile, or, informally, a movie buff.",,,,,,,,,,,,
Citizenship,GT,PST,,,,,A native or naturalized person who owes allegiance to a government and is entitled to protection from it •,,,,,,,,,,,,
Classic film,GT,PST,,,,,"Classic films are often universal favorites that hold up after repeated rescreenings. Classics are renowned films of first rank, reference points in film mythology, or films that have become a part of American cultural folklore",,,,,,,,,,,,
Collaboration,GT,PST,,,,,Work jointly with others or together especially in an intellectual endeavor,,,,,,,,,,,,
Colonialism,GT,PST,,,,,"a political-economic phenomenon whereby various European nations explored, conquered, settled, and exploited large areas of the world. The age of modern colonialism began about 1500, following the European discoveries of a sea route around Africa’s southern coast (1488) and of America (1492). With these events sea power shifted from the Mediterranean to the Atlantic and to the emerging nation-states of Portugal, Spain, the Dutch Republic, France, and England. By discovery, conquest, and settlement, these nations expanded and colonized throughout the world, spreading European institutions and culture.",,,,,,,,,,,,
Comanche Nation,GT,PST,,,,,"A Native American nation from the Great Plains whose historic territory, known as Comancheria, consisted of present-day eastern New Mexico, southeastern Colorado, southwestern Kansas, western Oklahoma, and most of northwest Texas and northern Chihuahua",,,,,,,,,,,,
Advertising,GT,PST,,,,,"Shorts aimed at selling products in partnership with brands. Popular way of gathering cash fast, either for project financing, or living expenses in the case of directors or other crew members who are not well known",,,,,,,,,,,,
Communism,GT,PST,,,,,A totalitarian system of government in which a single authoritarian party controls state-owned means of production,,,,,,,,,,,,
Concert,GT,PST,,,,,A public performance (as of music or dancing),,,,,,,,,,,,
Consciousness,GT,PST,,,,,The fact of awareness by the mind of itself and the world,,,,,,,,,,,,
Convent School,GT,PST,,,,,"a school, especially one for girls, attached to and run by convent.",,,,,,,,,,,,
"Corcoran, California",GT,PST,,,,,"A city in Kings County, California",,,,,,,,,,,,
Corruption,GT,PST,,,,,"dishonest or fraudulent conduct by those in power, typically involving briber",,,,,,,,,,,,
Costumbrism Comedy,GF,PST,,Literary realism,,,"(Costumbrismo) Literature from the nineteenth century that reflects the social customs, in many cases without analyzing them or interpreting them critically. Its most popular and less intellectual slope is limited to the description of the most apparent and colorful of everyday life.",,,,,,,,,,,,
Costume,TP,PST,,,,,"An outfit worn to create the appearance characteristic of a particular period, person, place, or thing",,,,,,,,,,,,
Cristera War (1926-29),ET,PST,,Cristero Rebellion,,,"a widespread struggle in many central-western Mexican states against the secularist, anti-Catholic and anti-clerical policies of the Mexican government",,,,,,,,,,,,
Critical Reception,GT,PST,,,,,,,,,,,,,,,,,
Cuban Missile Crisis (1962),ET,PST,,,,,A major confrontation that brought the United States and the Soviet Union close to war over the presence of Soviet nuclear-armed missiles in Cuba.,,,,,,,,,,,,
Cuban Revolution (1953-1959),ET,PST,,,,,The Cuban Revolution was an armed revolt conducted by Fidel Castro's 26th of July Movement and its allies against the right-wing authoritarian government of Cuban President Fulgencio Batista,,,,,,,,,,,,
Cult,GT,PST,,,,,a system of religious veneration and devotion directed toward a particular figure or object,,,,,,,,,,,,
Culture,GT,PST,,,,,"The customary beliefs, social forms, and material traits of a racial, religious, or social group",,,,,,,,,,,,
Dailies,TP,PST,,Rushes,,Daily Rushes,Daily raw footage shot during the production of a motion picture,,,,,,,,,,,,
Day of the Dead,ET,PST,,,,,"A Mexican holiday celebrated throughout Mexico, in particular the Central and South regions, and by people of Mexican ancestry living in other places, especially the United States",,,,,,,,,,,,
De Colores song,GT,PST,,,,,Anthem for the United Farm Workers,,,,,,,,,,,,
Debt,GT,PST,,,,,"something, typically money, that is owed or due.",,,,,,,,,,,,
Delano Grape Strike,ET,PST,,,,,"In 1965, Filipino and Mexican American farm workers in Delano, California, began a strike against area grape growers for equal wages for foreign workers. This historic strike lasted more than 5 years and resulted in contracts for more than 10,000 workers. It also launched the United Farm Workers of America (UFW) and made leader Cesar Chavez one of the most celebrated figures of the 20th century",,,,,,,,,,,,
"Delano, California",GT,PST,,,,,"A city in Kern County, California",,,,,,,,,,,,
Deportation,GT,PST,,,,,The removal from a country of an alien whose presence is unlawful or prejudicial,,,,,,,,,,,,
Dialog,TP,PST,,Dialogue,,,"conversation between two or more people as a feature of a book, play, or movie.",,,,,,,,,,,,
Dictatorship,GT,PST,,,,,A form of government in which one person or a small group possesses absolute power,,,,,,,,,,,,
Digital Cinema,TP,PST,,,,,"Digital cinema refers to the use of digital technology to distribute or project motion pictures as opposed to the historical use of reels of motion picture film, such as 35 mm film",,,,,,,,,,,,
Director,PC,PST,,,,,The work of supervising and controlling actors and other personnel during the pre-production and production of a film.,,,,,,,,,,,,
Disney movies,GF,PST,,,,,Movies made by Walter Elias Disney 1901–1966 American film producer,,,,,,,,,,,,
Film Distribution,TP,PST,,,,,The process of making a movie available for viewing by an audience.,,,,,,,,,,,,
Divorce,GT,PST,,,,,The legal dissolution of a marriage by a court or other competent body,,,,,,,,,,,,
Doctor,GT,PST,,,,,A 'qualified practitioner of medicine; a physician,,,,,,,,,,,,
Documentary,GF,PST,,,,,A movie or a television or radio program that provides a factual record or report.,,,,,,,,,,,,
Dreams,GT,PST,,,,,"A series of thoughts, images, or emotions occurring during sleep •",,,,,,,,,,,,
Drugs,GT,PST,,,,,"Often an illegal substance that causes addiction, habituation (see habituation 2b), or a marked change in consciousness",,,,,,,,,,,,
Dubbed,TP,PST,,,,,"To insert a new soundtrack, often a synchronized translation of the original dialogue, into (a film). (The Free Dictionary by Farlex)",,,,,,,,,,,,
Education,GT,PST,,,,,"Where they studied, from early years to university or trade school (film school)",,,,,,,,,,,,
Entertainment,GT,PST,,,,,"An event, performance, or activity designed to entertain others.",,,,,,,,,,,,
Estudios Churubusco,GT,PST,,,,,Estudios Churubusco is one of the oldest and largest movie studios in Latin America located in theChurubusco neighborhood of Mexico City,,,,,,,,,,,,
Excavation,GT,PST,,,,,"the action of excavating something, especially an archaeological site.",,,,,,,,,,,,
Executive,PC,PST,,Execs,,,Having administrative or managerial responsibility (i.e. business executive),,,,,,,,,,,,
Experimental film,GF,PST,,,,,Cinema or avant-garde cinema is a mode of filmmaking that rigorously re-evaluates cinematic conventions and explores non-narrative forms and alternatives to traditional narratives or methods of working.,,,,,,,,,,,,
Facism,GT,PST,,,,,An authoritarian and nationalistic right-wing system of government and social organization,,,,,,,,,,,,
Fairy tales,TP,PST,,,,,A type of short story that typically features folkloric fantasy characters,,,,,,,,,,,,
Family,GT,PST,,,,,Relationships/household life in early years. Also derivative roles (mother/father/siblings/sister/brother/garndmother/grandfather/etc),,,,,,,,,,,,
Fantasy,GF,PST,,,,,imaginative fiction dependent for effect on strangeness of setting (such as other worlds or times) and of characters (such as supernatural or unnatural beings).,,,,,,,,,,,,
Farm Workers,GT,PST,,,,,A person employed to work on a farm,,,,,,,,,,,,
Feature Film,GF,PST,,,,,A full-length film intended as the main item in a movie theater program.,,,,,,,,,,,,
Feminism,GT,PST,,The Women's Movement,,,The advocacy of women's rights on the basis of the equality of the sexes.,,,,,,,,,,,,
Fencing,GT,PST,,,,,"The sport of fighting with swords, especially foils, épées, or sabers, according to a set of rules, in order to score points against an opponent",,,,,,,,,,,,
Filipino Hall,GT,PST,,,,,,,,,,,,,,,,,
Film critic,PC,PST,,,,,a person who writes or publishes a review of a film from either an artistic or entertainment point of view. Film critic does the analysis and evaluation offilms,,,,,,,,,,,,
Film editor,PC,PST,,,,,"Is the art, technique, and practice of assembling shots into a coherent sequence. The job of an editor is not simply to mechanically put pieces of a film together, cut off film slates, or edit dialogue scenes.",,,,,,,,,,,,
Film exhibition,TP,PST,,,,,"The process of scheduling and screening a film in a cinema… Around the world, purpose built cinemas, usually located in cities or towns, became the primary location for screening and viewing films… Alongside mainstream commercial film exhibition practices, a variety of alternative strategies have, and continue to be, used",,,,,,,,,,,,
Film festivals,GT,PST,,,,,"Various festivals, should all be labeled by their own names as well",,,,,,,,,,,,
Film Independent,GT,PST,,,,,"The organization took on production of the Independent Spirit Awards in the late 1980s and assumed ownership of the Los Angeles Film Festival in 2000. In time, IFP/West became Film Independent—a more accurate banner for the spectrum of services the organization had expanded to include.",,,,,,,,,,,,
Film noir,GF,PST,,,,,"Cinematic term used primarily to describe stylish Hollywood crime dramas, particularly such that emphasize cynical attitudes and sexual motivations",,,,,,,,,,,,
Film school,GT,PST,,,,,,,,,,,,,,,,,
Film society,GT,PST,,,,,"A film society is a membership club where people can watch screenings of films which would otherwise not be shown in mainstream cinemas. In Spain, Ireland and Italy, they are known as ""cineclubs"", and in Germany they are known as ""filmclubs"". They usually have an educational aim, introducing new audiences to different audiovisual works through an organized and prepared program of screenings.",,,,,,,,,,,,
Film unions,GT,PST,,,,,,,,,,,,,,,,,
Filming location,TP,PST,,,,,"A place where some or all of a film or television series is produced, in addition to or instead of using sets constructed on a movie studio backlot or soundstage. In filmmaking, a location is any place where a film crew will be filming actors and recording their dialog.",,,,,,,,,,,,
Filmmaker,PC,PST,,,,,A person who directs or produces movies for the theater or television.,,,,,,,,,,,,
Filmmaking technology,TP,PST,,,,,,,,,,,,,,,,,
French New Wave,ET,PST,,Nouvelle Vague,,,Term coined by critics for a group of French filmmakers of the late 1950s and 1960s.French New Wave Cinema rejected traditional linear tropes of storytelling and created a new language of film,,,,,,,,,,,,
Fulbright Scholarship,GT,PST,,,,,Scholarship,,,,,,,,,,,,
Funding,GT,PST,,,,,Where the $ to make a film came from,,,,,,,,,,,,
Fundraising,GT,PST,,,,,"the seeking of financial support for a charity, cause, or other enterprise.",,,,,,,,,,,,
Golden Age of Mexican Cinema,GT,PST,,Mexican Studio System,,,"The golden age of Mexican cinema, which spanned the 1930s through to the 1950s, saw Mexico's film industry become one of the most productive in the world, exercising a decisive influence on national culture and identity.",,,,,,,,,,,,
Great Depression,GF,PST,,,,,worldwide economic downturn that began in 1929 and lasted until about 1939. It was the longest and most severe depression ever experienced by the industrialized Western world,,,,,,,,,,,,
Greek tragedy,GT,PST,,,,,"Is a form of theatre from Ancient Greece and Asia Minor. It reached its most significant form in Athens in the 5th century BC, the works of which are sometimes called Attic tragedy. Greek tragedy is widely believed to be an extension of the ancient rites carried out in honor of Dionysus, and it heavily influenced the theatre of Ancient Rome and the Renaissance",,,,,,,,,,,,
"Guadalajara, Mexico",GT,PST,,,,,"A city in western Mexico. It’s known for tequila and mariachi music, both born in Jalisco, the state of which Guadalajara is the capital. Guadalajara’s historic center is dotted with colonial plazas and landmarks such as the neoclassical Teatro Degollado",,,,,,,,,,,,
Guatemalan Civil War (1960-1994),ET,PST,,,,,"The Guatemalan Civil War ran from 1960 to 1996. It was fought between the government of Guatemala and various leftist rebel groups supported chiefly by ethnic Maya indigenous people and Ladino peasants, who together make up the rural poor",,,,,,,,,,,,
Hand-held camera,TP,PST,,,,,"Cinematographic technique where stable-image techniques are purposely dispensed with. The camera is held in the hand, or given the appearance of being hand-held, and in many cases shots are limited to what one photographer Often employed to give a film sequence an ad hoc, electronic news-gathering, or documentary film feel.",,,,,,,,,,,,
History of film,GT,PST,,,,,,,,,,,,,,,,,
History of Mexico,GT,PST,,,,,,,,,,,,,,,,,
"Hollywood, California",GT,PST,,,,,"Literal place in Los Angeles, also figurative place that is a stand in for the film industry",,,,,,,,,,,,
Home movies,TP,PST,,,,,A movie that one makes for people to watch in one's home and that is usually of the family or a family event,,,,,,,,,,,,
Homosexuality,GT,PST,,,,,Sexual attraction to people of one's own sex.,,,,,,,,,,,,
Horror,GF,PST,,,,,"calculated to cause intense repugnance, fear, or dread. Horror films may incorporate incidents of physical violence and psychological terror; they may be studies of deformed, disturbed, psychotic, or evil characters; stories of terrifying monsters or malevolent animals; or mystery thrillers that use atmosphere to build suspense. The genre often overlaps science-fiction films and film noir.",,,,,,,,,,,,
Horseback Riding,GT,PST,,,,,,,,,,,,,,,,,
Immigration,GT,PST,,,,,People from one country coming to another country to live; from a poor country lacking opportunity to a rich country with a promise of living a better life (US/Mexico/Central America),,,,,,,,,,,,
Improvisation,GT,PST,,,,,Something (such as a musical or dramatic composition) improvised,,,,,,,,,,,,
Independent film,GF,PST,,,,,Cinema outside Hollywood (in US) or out of the mainstream channels in Latin America.,,,,,,,,,,,,
Indigenous culture,GT,PST,,,,,"Produced, growing, living, or occurring naturally in a particular region or environment",,,,,,,,,,,,
Italian Neorealism,GF,PST,,,,,"a national film movement characterized by stories set amongst the poor and the working class, filmed on location, frequently using non-professional actors.",,,,,,,,,,,,
Jealousy,GT,PST,,,,,the state or feeling of being jealous,,,,,,,,,,,,
"Juarez, Mexico",GT,PST,,Ciudad Juarez,,,The largest city in the Mexican state of Chihuahua,,,,,,,,,,,,
Judaism,GT,PST,,,,,"monotheistic religion developed among the ancient Hebrews. Judaism is characterized by a belief in one transcendent God who revealed himself to Abraham, Moses, and the Hebrew prophets and by a religious life in accordance with Scriptures and rabbinic traditions. Judaism is the complex phenomenon of a total way of life for the Jewish people, comprising theology, law, and innumerable cultural traditions.",,,,,,,,,,,,
Judeo Christian tradition,GT,PST,,,,,,,,,,,,,,,,,
